[
  {
    "categoryId": "cat_001",
    "name": "Tools & Equipment",
    "parentId": null,
    "isActive": true,
    "sortOrder": 1,
    "level": 0,
    "description": "Description for Tools & Equipment",
    "urlKey": "tools-equipment"
  },
  {
    "categoryId": "cat_002",
    "name": "Building Materials",
    "parentId": null,
    "isActive": true,
    "sortOrder": 2,
    "level": 0,
    "urlKey": "building-materials"
  },
  {
    "categoryId": "cat_003",
    "name": "Safety & Protection",
    "parentId": null,
    "isActive": true,
    "sortOrder": 3,
    "level": 0,
    "description": "Description for Safety & Protection",
    "urlKey": "safety-protection"
  },
  {
    "categoryId": "cat_004",
    "name": "Power Tools",
    "parentId": "cat_001",
    "isActive": true,
    "sortOrder": 4,
    "level": 1,
    "description": "Description for Power Tools"
  },
  {
    "categoryId": "cat_005",
    "name": "Hand Tools",
    "parentId": "cat_001",
    "isActive": true,
    "sortOrder": 5,
    "level": 1,
    "description": "Description for Hand Tools"
  },
  {
    "categoryId": "cat_006",
    "name": "Tool Storage",
    "parentId": "cat_001",
    "isActive": true,
    "sortOrder": 6,
    "level": 1,
    "urlKey": "tool-storage"
  },
  {
    "categoryId": "cat_007",
    "name": "Lumber",
    "parentId": "cat_002",
    "isActive": true,
    "sortOrder": 7,
    "level": 1,
    "description": "Description for Lumber"
  },
  {
    "categoryId": "cat_008",
    "name": "Concrete & Masonry",
    "parentId": "cat_002",
    "isActive": true,
    "sortOrder": 8,
    "level": 1,
    "urlKey": "concrete-masonry"
  },
  {
    "categoryId": "cat_009",
    "name": "Insulation",
    "parentId": "cat_002",
    "isActive": true,
    "sortOrder": 9,
    "level": 1,
    "description": "Description for Insulation",
    "urlKey": "insulation"
  },
  {
    "categoryId": "cat_010",
    "name": "Roofing",
    "parentId": "cat_002",
    "isActive": true,
    "sortOrder": 10,
    "level": 1,
    "description": "Description for Roofing"
  },
  {
    "categoryId": "cat_011",
    "name": "Personal Protection",
    "parentId": "cat_003",
    "isActive": true,
    "sortOrder": 11,
    "level": 1,
    "description": "Description for Personal Protection",
    "urlKey": "personal-protection"
  },
  {
    "categoryId": "cat_012",
    "name": "Site Safety",
    "parentId": "cat_003",
    "isActive": true,
    "sortOrder": 12,
    "level": 1,
    "description": "Description for Site Safety",
    "urlKey": "site-safety"
  },
  {
    "categoryId": "cat_013",
    "name": "Drills",
    "parentId": "cat_004",
    "isActive": true,
    "sortOrder": 13,
    "level": 2,
    "description": "Description for Drills",
    "urlKey": "drills"
  },
  {
    "categoryId": "cat_014",
    "name": "Saws",
    "parentId": "cat_004",
    "isActive": true,
    "sortOrder": 14,
    "level": 2,
    "description": "Description for Saws"
  },
  {
    "categoryId": "cat_015",
    "name": "Sanders",
    "parentId": "cat_004",
    "isActive": true,
    "sortOrder": 15,
    "level": 2
  },
  {
    "categoryId": "cat_016",
    "name": "Hammers",
    "parentId": "cat_005",
    "isActive": true,
    "sortOrder": 16,
    "level": 2,
    "description": "Description for Hammers"
  },
  {
    "categoryId": "cat_017",
    "name": "Wrenches",
    "parentId": "cat_005",
    "isActive": true,
    "sortOrder": 17,
    "level": 2,
    "description": "Description for Wrenches"
  },
  {
    "categoryId": "cat_018",
    "name": "Screwdrivers",
    "parentId": "cat_005",
    "isActive": true,
    "sortOrder": 18,
    "level": 2
  },
  {
    "categoryId": "cat_019",
    "name": "Safety Helmets",
    "parentId": "cat_011",
    "isActive": true,
    "sortOrder": 19,
    "level": 2,
    "description": "Description for Safety Helmets",
    "urlKey": "safety-helmets"
  }
]